name,price,urlname,price,url
Подвесной светильник Селф White,4500,https://www.divan.ru/product/podvesnoj-svetilnik-self-white
Подвесной светильник Moderli Lewes,16 160,https://www.divan.ru/product/podvesnoj-svetilnik-moderli-lewes
Бра Cornus White,5820,https://www.divan.ru/product/bra-cornus-white
Подвесной светильник Клэри Brown,10 440,https://www.divan.ru/product/podvesnoj-svetilnik-kleri-brown
Подвесной светильник Вэлли Gray,7140,https://www.divan.ru/product/podvesnoj-svetilnik-velli-gray
Бра Равелло Black,6480,https://www.divan.ru/product/bra-ravello-black
Подвесной светильник Талли Black,8240,https://www.divan.ru/product/podvesnoj-svetilnik-talli-black
Спот Лайт-1 White,3180,https://www.divan.ru/product/spot-lajt-1-white
Подвесной светильник Агато Black,10 440,https://www.divan.ru/product/podvesnoj-svetilnik-agato-black
Подвесной светильник Priddy,10 880,https://www.divan.ru/product/podvesnoj-svetilnik-priddy
Бра Твинки Black,4060,https://www.divan.ru/product/bra-tvinki-black
Подвесной светильник Фиона Black,3290,https://www.divan.ru/product/podvesnoj-svetilnik-fiona-black
Настольная лампа Омаха White,9670,https://www.divan.ru/product/nastolnaya-lampa-omaha-white
Подвесной светильник Агато Brown,10 440,https://www.divan.ru/product/podvesnoj-svetilnik-agato-brown
Подвесной светильник Moderli Host-1,4830,https://www.divan.ru/product/podvesnoj-svetilnik-moderli-host-1
Подвесной светильник Ори White,3290,https://www.divan.ru/product/podvesnoj-svetilnik-ori-white
Подвесной светильник Ринна White,6150,https://www.divan.ru/product/podvesnoj-svetilnik-rinna-white
Бра Леон Black,2630,https://www.divan.ru/product/bra-leon-black
Подвесной светильник Эйр Brown,6590,https://www.divan.ru/product/podvesnoj-svetilnik-ejr-brown
Подвесной светильник Ридж White,3620,https://www.divan.ru/product/podvesnoj-svetilnik-ridj-white
Бра Брик Black,4610,https://www.divan.ru/product/bra-brik-black
Бра Твинки Grey,4060,https://www.divan.ru/product/bra-tvinki-grey
Настольная лампа Шоу Black,7910,https://www.divan.ru/product/nastolnaya-lampa-shou-black
Подвесной светильник Мантис Olive,19 790,https://www.divan.ru/product/podvesnoj-svetilnik-mantis-olive
Подвесной светильник Пескара Yellow,5710,https://www.divan.ru/product/podvesnoj-svetilnik-peskara-yellow
Подвесной светильник Ринна Beige,6150,https://www.divan.ru/product/podvesnoj-svetilnik-rinna-beige
Подвесной светильник Ори Black,3400,https://www.divan.ru/product/podvesnoj-svetilnik-ori-black
Подвесной светильник Фиона Gray,3400,https://www.divan.ru/product/podvesnoj-svetilnik-fiona-gray
Подвесной светильник Эйр Beige,6590,https://www.divan.ru/product/podvesnoj-svetilnik-ejr-beige
Подвесной светильник Клэри BLack,10 440,https://www.divan.ru/product/podvesnoj-svetilnik-kleri-black
Подвесной светильник Альта Gold,4720,https://www.divan.ru/product/podvesnoj-svetilnik-alta-gold
Подвесной светильник Мантис Black,19 790,https://www.divan.ru/product/podvesnoj-svetilnik-mantis-black
Люстра Ливсден Brown,17 590,https://www.divan.ru/product/lyustra-livsden-brown
Подвесной светильник Плейн White,12 090,https://www.divan.ru/product/podvesnoj-svetilnik-plejn-white
Подвесной светильник Лечче Mint,5050,https://www.divan.ru/product/podvesnoj-svetilnik-lechche-mint
Подвесной светильник Фиона White,3290,https://www.divan.ru/product/podvesnoj-svetilnik-fiona-white
Подвесной светильник Селф Black,4610,https://www.divan.ru/product/podvesnoj-svetilnik-self-black
Подвесной светильник Вэлли Brown,7140,https://www.divan.ru/product/podvesnoj-svetilnik-velli-brown
Подвесной светильник Ринна Black,5820,https://www.divan.ru/product/podvesnoj-svetilnik-rinna-black
Настольная лампа Отто Black,4940,https://www.divan.ru/product/nastolnaya-lampa-otto-black
Подвесной светильник Ливсден Brown,4390,https://www.divan.ru/product/podvesnoj-svetilnik-livsden-brown
Настольная лампа Ливсден Brown,7690,https://www.divan.ru/product/nastolnaya-lampa-livsden-brown
Бра Флиммер Black,1860,https://www.divan.ru/product/bra-flimmer-black
Люстра Флиммер Black,6920,https://www.divan.ru/product/lyustra-flimmer-black
Подвесной светильник Флиммер Black,2080,https://www.divan.ru/product/podvesnoj-svetilnik-flimmer-black
Настольная лампа Флиммер Black,3290,https://www.divan.ru/product/nastolnaya-lampa-flimmer-black
Торшер Флиммер Black,5490,https://www.divan.ru/product/torsher-flimmer-black
Подвесной светильник Альта White,4390,https://www.divan.ru/product/podvesnoj-svetilnik-alta-white
Подвесной светильник Мантис Brown,19 790,https://www.divan.ru/product/podvesnoj-svetilnik-mantis-brown
Люстра Гейза Black,10 990,https://www.divan.ru/product/lyustra-gejza-black
Настольная лампа Гейза Black,3840,https://www.divan.ru/product/nastolnaya-lampa-gejza-black
Настольная лампа Гейза Pink,3290,https://www.divan.ru/product/nastolnaya-lampa-gejza-pink
Настольная лампа Гейза Blue,3290,https://www.divan.ru/product/nastolnaya-lampa-gejza-blue
Настольная лампа Гейза Orange,4390,https://www.divan.ru/product/nastolnaya-lampa-gejza-orange
Настольная лампа Алней Black,4390,https://www.divan.ru/product/nastolnaya-lampa-alnej-black
Настольная лампа Алней Beige,4390,https://www.divan.ru/product/nastolnaya-lampa-alnej-beige
Настольная лампа Алней Green,4390,https://www.divan.ru/product/nastolnaya-lampa-alnej-green
Настольная лампа Алней Orange,4390,https://www.divan.ru/product/nastolnaya-lampa-alnej-orange
Торшер Отто Black,8350,https://www.divan.ru/product/torsher-otto-black
Торшер Алней Green,8790,https://www.divan.ru/product/torsher-alnej-green
Торшер Алней Black,8790,https://www.divan.ru/product/torsher-alnej-black
Торшер Алней Orange,8790,https://www.divan.ru/product/torsher-alnej-orange
Торшер Алней Beige,8790,https://www.divan.ru/product/torsher-alnej-beige
Настольная лампа Арбет Orange,2630,https://www.divan.ru/product/nastolnaya-lampa-arbet-orange
Настольная лампа Арбет Silver,2960,https://www.divan.ru/product/nastolnaya-lampa-arbet-silver
Настольная лампа Арбет Beige,2190,https://www.divan.ru/product/nastolnaya-lampa-arbet-beige
Настольная лампа Арбет White,2630,https://www.divan.ru/product/nastolnaya-lampa-arbet-white
Настольная лампа Арбет Black,2190,https://www.divan.ru/product/nastolnaya-lampa-arbet-black
Настольная лампа Синдри Grey,4830,https://www.divan.ru/product/nastolnaya-lampa-sindri-grey
Люстра Синдри Black,12 090,https://www.divan.ru/product/lyustra-sindri-black
Настольная лампа Манэт White,2960,https://www.divan.ru/product/nastolnaya-lampa-manet-white
Настольная лампа Леррет Beige,4390,https://www.divan.ru/product/nastolnaya-lampa-lerret-beige
Настольная лампа Леррет White,2190,https://www.divan.ru/product/nastolnaya-lampa-lerret-white
Настольная лампа Истад Black,1860,https://www.divan.ru/product/nastolnaya-lampa-istad-black
Настольная лампа Истад White,1860,https://www.divan.ru/product/nastolnaya-lampa-istad-white
Люстра Боллар White,25 290,https://www.divan.ru/product/lyustra-bollar-white
Настольная лампа Рибе Black,2190,https://www.divan.ru/product/nastolnaya-lampa-ribe-black
Настольная лампа Рибе Orange,2190,https://www.divan.ru/product/nastolnaya-lampa-ribe-orange
Настольная лампа Снибальд White,760,https://www.divan.ru/product/nastolnaya-lampa-snibald-white
Настольная лампа Спайк Pink,1090,https://www.divan.ru/product/nastolnaya-lampa-spajk-pink
Настольная лампа Спайк White,1090,https://www.divan.ru/product/nastolnaya-lampa-spajk-white
Настольная лампа Астри Black,1090,https://www.divan.ru/product/nastolnaya-lampa-astri-black
Настольная лампа Астри Beige,1090,https://www.divan.ru/product/nastolnaya-lampa-astri-beige
Подвесной светильник Клауд White,10 990,https://www.divan.ru/product/podvesnoj-svetilnik-klaud-white
Торшер Клауд White,20 120,https://www.divan.ru/product/torsher-klaud-white
Настольная лампа Клауд White,17 590,https://www.divan.ru/product/nastolnaya-lampa-klaud-white
Настольная лампа Машрум Olive,4390,https://www.divan.ru/product/nastolnaya-lampa-mashrum-olive
Настольная лампа Машрум Pink,4390,https://www.divan.ru/product/nastolnaya-lampa-mashrum-pink
Подвесной светильник Селау-2 Glass,4390,https://www.divan.ru/product/podvesnoj-svetilnik-selau-2-glass
Бра Пинна Black,7690,https://www.divan.ru/product/bra-pinna-black
Подвесной светильник Лечче Black,5490,https://www.divan.ru/product/podvesnoj-svetilnik-lechche-black
Торшер Флинт-1 White,15 280,https://www.divan.ru/product/torsher-flint-1-white
Бра Техно Стрикт-1 Black,3950,https://www.divan.ru/product/bra-tehno-strikt-1-black
Подвесной светильник Ньютаун-1 Black,12 640,https://www.divan.ru/product/podvesnoj-svetilnik-nyutaun-1-black
Торшер Pinocchio,17 700,https://www.divan.ru/product/torsher-pinocchio
Торшер Ливсден Brown,13 190,https://www.divan.ru/product/torsher-livsden-brown
Настольная лампа Нидлс Raffia Beige,5490,https://www.divan.ru/product/nastolnaya-lampa-nidls-raffia-beige
Настольная лампа Спайк Green,1090,https://www.divan.ru/product/nastolnaya-lampa-spajk-green
Торшер Раффи Round,13 190,https://www.divan.ru/product/torsher-raffi-round
Торшер Гросс White,8790,https://www.divan.ru/product/torsher-gross-white
Торшер Вена Beige,13 190,https://www.divan.ru/product/torsher-vena-beige
Подвесной светильник Лума Gold,5490,https://www.divan.ru/product/podvesnoj-svetilnik-luma-gold
Подвесной светильник Дроп Beige,3840,https://www.divan.ru/product/podvesnoj-svetilnik-drop-beige
Подвесной светильник Дроп Gray,3290,https://www.divan.ru/product/podvesnoj-svetilnik-drop-gray
Подвесной светильник Дроп White,3290,https://www.divan.ru/product/podvesnoj-svetilnik-drop-white
Подвесной светильник Дроп Black,3070,https://www.divan.ru/product/podvesnoj-svetilnik-drop-black
Настольная лампа Сфера Black,5930,https://www.divan.ru/product/nastolnaya-lampa-sfera-black
Подвесной светильник Пескара Green,5600,https://www.divan.ru/product/podvesnoj-svetilnik-peskara-green
Торшер Moderli Floor White,7690,https://www.divan.ru/product/torsher-moderli-floor-white
Настольная лампа Флейк White,8790,https://www.divan.ru/product/nastolnaya-lampa-flejk-white
Подвесной светильник Флейк White,6590,https://www.divan.ru/product/podvesnoj-svetilnik-flejk-white
Торшер Шоу Black,13 190,https://www.divan.ru/product/torsher-shou-black
Торшер Нидлс Khaki,16 490,https://www.divan.ru/product/torsher-nidls-khaki
Торшер Грено Black,13 190,https://www.divan.ru/product/torsher-greno-black
Настольная лампа Гровер Glass,7140,https://www.divan.ru/product/nastolnaya-lampa-grover-glass
Подвесной светильник Плейн Black,13 190,https://www.divan.ru/product/podvesnoj-svetilnik-plejn-black
Торшер Вена Black,13 190,https://www.divan.ru/product/torsher-vena-black
Настольная лампа Сфера Orange,5930,https://www.divan.ru/product/nastolnaya-lampa-sfera-orange
Настольная лампа Спайк Orange,1090,https://www.divan.ru/product/nastolnaya-lampa-spajk-orange
Торшер Портланд Black,6590,https://www.divan.ru/product/torsher-portland-black
Подвесной светильник Бабл Quartz,12 640,https://www.divan.ru/product/podvesnoj-svetilnik-babl-quartz
Подвесной светильник Рэн Gray,9890,https://www.divan.ru/product/podvesnoj-svetilnik-ren-gray
Подвесной светильник Пескара Black,7910,https://www.divan.ru/product/podvesnoj-svetilnik-peskara-black
Подвесной светильник Лечче Rose,5600,https://www.divan.ru/product/podvesnoj-svetilnik-lechche-rose
Подвесной светильник Рэн Beige,9890,https://www.divan.ru/product/podvesnoj-svetilnik-ren-beige
Настольная лампа Флинт White,7690,https://www.divan.ru/product/torsher-flint-white
Подвесной светильник Рэн Gold,8790,https://www.divan.ru/product/podvesnoj-svetilnik-ren-gold
Торшер Флейк White,14 290,https://www.divan.ru/product/torsher-flejk-white
Светильник потолочный Ринга Black,4390,https://www.divan.ru/product/svetilnik-potolochnyj-ringa-black
Светильник потолочный Ринга White,4390,https://www.divan.ru/product/svetilnik-potolochnyj-ringa-white
Светильник потолочный Лаго White,12 090,https://www.divan.ru/product/svetilnik-potolochnyj-lago-white
Подвесной светильник Рена Green,3840,https://www.divan.ru/product/podvesnoj-svetilnik-rena-green
Подвесной светильник Рена White,3840,https://www.divan.ru/product/podvesnoj-svetilnik-rena-white
Подвесной светильник Бейла Black,5930,https://www.divan.ru/product/podvesnoj-svetilnik-bejla-black
Подвесной светильник Кронор Black,8020,https://www.divan.ru/product/podvesnoj-svetilnik-kronor-black
Подвесной светильник Бейла White,5820,https://www.divan.ru/product/podvesnoj-svetilnik-bejla-white
Настольная лампа Требен Orange,3290,https://www.divan.ru/product/nastolnaya-lampa-treben-orange
Подвесной светильник Кая White,3290,https://www.divan.ru/product/podvesnoj-svetilnik-kaya-white
Торшер Осло White,18 690,https://www.divan.ru/product/torsher-oslo-white
Подвесной светильник Портланд Black,3950,https://www.divan.ru/product/podvesnoj-svetilnik-portland-black
Подвесной светильник Сансет Black,6590,https://www.divan.ru/product/podvesnoj-svetilnik-sanset-black
Настольная лампа Гросс White,5160,https://www.divan.ru/product/nastolnaya-lampa-gross-white
Настольная лампа Сканди White,5160,https://www.divan.ru/product/nastolnaya-lampa-skandi-white
Торшер Сканди White,10 990,https://www.divan.ru/product/torsher-skandi-white
Подвесной светильник Бабл-3,6040,https://www.divan.ru/product/podvesnoj-svetilnik-babl-3
Бра Бабл Black,2520,https://www.divan.ru/product/bra-babl-black
Настольная лампа Дэнди Black,4940,https://www.divan.ru/product/nastolnaya-lampa-dendi-black
Настольная лампа Дэнди White,4940,https://www.divan.ru/product/nastolnaya-lampa-dendi-white
Торшер Варио White,6040,https://www.divan.ru/product/torsher-vario-white
Бра Варио Black,1090,https://www.divan.ru/product/bra-vario-black
Бра Варио White,1090,https://www.divan.ru/product/bra-vario-white
Подвесной светильник Сансет White,4390,https://www.divan.ru/product/podvesnoj-svetilnik-sanset-white
Торшер Мун Black,9890,https://www.divan.ru/product/torsher-mun-black
Бра Moderli Alina,3070,https://www.divan.ru/product/bra-moderli-alina
Подвесной светильник Маро Green,8350,https://www.divan.ru/product/podvesnoj-svetilnik-maro-green
Настольная лампа Taeda,5490,https://www.divan.ru/product/nastolnaya-lampa-taeda
Бра Galdakao-1,7250,https://www.divan.ru/product/bra-galdakao
Торшер Билли White,21 660,https://www.divan.ru/product/torsher-billi-white
Подвесной светильник Ори Gold,3400,https://www.divan.ru/product/podvesnoj-svetilnik-ori-gold
Бра Bolla-Unica,5820,https://www.divan.ru/product/bra-bolla-unica
Подвесной светильник Онтарио Olive,11 540,https://www.divan.ru/product/podvesnoj-svetilnik-ontario-olive
Подвесной светильник Онтарио Brown,13 630,https://www.divan.ru/product/podvesnoj-svetilnik-ontario-brown
Настольная лампа Moderli Suspent,4390,https://www.divan.ru/product/nastolnaya-lampa-moderli-suspent
Подвесной светильник Онтарио Gray,13 630,https://www.divan.ru/product/podvesnoj-svetilnik-ontario-gray
Торшер Moderli Suspent,8350,https://www.divan.ru/product/torsher-moderli-suspent
Подвесной светильник Альта Black,4720,https://www.divan.ru/product/podvesnoj-svetilnik-alta-black
Подвесной светильник Narices-1,33 320,https://www.divan.ru/product/podvesnoj-svetilnik-narices-1
Подвесной светильник Селф Gold,4830,https://www.divan.ru/product/podvesnoj-svetilnik-self-gold
Подвесной светильник Кая Black,3180,https://www.divan.ru/product/podvesnoj-svetilnik-kaya-black
Подвесной светильник Эйр White,6920,https://www.divan.ru/product/podvesnoj-svetilnik-ejr-white
Бра Бьйорк White,2740,https://www.divan.ru/product/bra-bjork-white
Настольная лампа Арвика Wood,6590,https://www.divan.ru/product/nastolnaya-lampa-arvika-wood
Настольная лампа Бьйорк White,4390,https://www.divan.ru/product/nastolnaya-lampa-bjork-white
Торшер Бьйорк White,12 090,https://www.divan.ru/product/torsher-bjork-white
Торшер Логмар Silver,18 690,https://www.divan.ru/product/torsher-logmar-silver
Торшер Логмар Black,18 690,https://www.divan.ru/product/torsher-logmar-black
Подвесной светильник Джамби-1 Rattan,10 990,https://www.divan.ru/product/podvesnoj-svetilnik-djambi-1-rattan
Подвесной светильник Джамби Rattan,15 390,https://www.divan.ru/product/podvesnoj-svetilnik-djambi-rattan
Подвесной светильник Гронтри-2 Wood,15 390,https://www.divan.ru/product/podvesnoj-svetilnik-grontri-2-wood
Подвесной светильник Гронтри-1 Wood,15 390,https://www.divan.ru/product/podvesnoj-svetilnik-grontri-1-wood
Подвесной светильник Гронтри Wood,12 090,https://www.divan.ru/product/podvesnoj-svetilnik-grontri-wood
Подвесной светильник Арвика Wood,8790,https://www.divan.ru/product/podvesnoj-svetilnik-arvika-wood
Подвесной светильник Скара Wood,3840,https://www.divan.ru/product/podvesnoj-svetilnik-skara-wood
Подвесной светильник Селау-1 Glass,5490,https://www.divan.ru/product/podvesnoj-svetilnik-selau-1-glass
Подвесной светильник Селау Glass,6590,https://www.divan.ru/product/podvesnoj-svetilnik-selau-glass
Подвесной светильник Бьйорк White,8790,https://www.divan.ru/product/podvesnoj-svetilnik-bjork-white
Подвесной светильник Ферум Orange,5490,https://www.divan.ru/product/podvesnoj-svetilnik-ferum-orange
Бра Берит Black,4720,https://www.divan.ru/product/bra-berit-black
Бра Берит Orange,5490,https://www.divan.ru/product/bra-berit-orange
Бра Бракетт Black,4940,https://www.divan.ru/product/bra-brakett-black
Бра Бракетт White,4940,https://www.divan.ru/product/bra-brakett-white
Подвесной светильник Малинг Olive,7360,https://www.divan.ru/product/podvesnoj-svetilnik-maling-olive
Подвесной светильник Малинг Orange,7360,https://www.divan.ru/product/podvesnoj-svetilnik-maling-orange
Подвесной светильник Малинг Black,7360,https://www.divan.ru/product/podvesnoj-svetilnik-maling-black
Торшер Осло Blue,19 790,https://www.divan.ru/product/torsher-oslo-blue
Торшер Осло Black,16 490,https://www.divan.ru/product/torsher-oslo-black
Торшер Энкель Black,6590,https://www.divan.ru/product/torsher-enkel-black
Настольная лампа Требен White,3290,https://www.divan.ru/product/nastolnaya-lampa-treben-white
Бра Смастен White,4390,https://www.divan.ru/product/bra-smasten-white
Бра Смастен Black,4390,https://www.divan.ru/product/bra-smasten-black
Подвесной светильник Тубули Wood,3290,https://www.divan.ru/product/podvesnoj-svetilnik-tubuli-wood
Подвесной светильник Тубули-5 Wood,13 520,https://www.divan.ru/product/podvesnoj-svetilnik-tubuli-5-wood
Подвесной светильник Бенфлит Black,7690,https://www.divan.ru/product/podvesnoj-svetilnik-benflit-black
Подвесной светильник Отра Wood,17 590,https://www.divan.ru/product/podvesnoj-svetilnik-otra-wood
Подвесной светильник Кронор White,8020,https://www.divan.ru/product/podvesnoj-svetilnik-kronor-white
Подвесной светильник Кронор Orange,8790,https://www.divan.ru/product/podvesnoj-svetilnik-kronor-orange
Подвесной светильник Исбит Transparent,8020,https://www.divan.ru/product/podvesnoj-svetilnik-isbit-transparent
Подвесной светильник Чинкве Silver,6040,https://www.divan.ru/product/podvesnoj-svetilnik-chinkve-silver
Подвесной светильник Чинкве Gold,6040,https://www.divan.ru/product/podvesnoj-svetilnik-chinkve-gold
Подвесной светильник Чинкве Gray,6040,https://www.divan.ru/product/podvesnoj-svetilnik-chinkve-gray
Светильник потолочный Орхус Black,17 590,https://www.divan.ru/product/svetilnik-potolochnyj-orhus-black
Светильник потолочный Орхус White,18 690,https://www.divan.ru/product/svetilnik-potolochnyj-orhus-white
